[
  {
    "id": "resurrection-orb",
    "name": "resurrection orb",
    "game_version": {
      "edition": "10th",
      "dataslate": "2025-q3"
    },
    "external_refs": [
      {
        "namespace": "mfm",
        "id": "22dc3b6e-d429-4499-a2da-498da8077982"
      },
      {
        "namespace": "mfm",
        "id": "35c788e0-4388-40e8-bdf0-879c51af5835"
      }
    ]
  },
  {
    "id": "dispersion-shield",
    "name": "dispersion shield",
    "game_version": {
      "edition": "10th",
      "dataslate": "2025-q3"
    },
    "external_refs": [
      {
        "namespace": "mfm",
        "id": "73c896ab-3e82-4c6c-8cd3-2490c776c67b"
      }
    ]
  },
  {
    "id": "shieldvanes",
    "name": "shieldvanes",
    "game_version": {
      "edition": "10th",
      "dataslate": "2025-q3"
    },
    "external_refs": [
      {
        "namespace": "mfm",
        "id": "106ffa9b-ad87-4845-a297-a73bceed0b02"
      }
    ]
  },
  {
    "id": "nebuloscope",
    "name": "nebuloscope",
    "game_version": {
      "edition": "10th",
      "dataslate": "2025-q3"
    },
    "external_refs": [
      {
        "namespace": "mfm",
        "id": "04af9b1c-d69e-4d55-a73f-1594f009207f"
      }
    ]
  },
  {
    "id": "shadowloom",
    "name": "shadowloom",
    "game_version": {
      "edition": "10th",
      "dataslate": "2025-q3"
    },
    "external_refs": [
      {
        "namespace": "mfm",
        "id": "0d59e1f0-4cca-4797-9810-89f34da9ac5a"
      }
    ]
  },
  {
    "id": "fabricator-claw-array",
    "name": "fabricator claw array",
    "game_version": {
      "edition": "10th",
      "dataslate": "2025-q3"
    }
  },
  {
    "id": "gloom-prism",
    "name": "gloom prism",
    "game_version": {
      "edition": "10th",
      "dataslate": "2025-q3"
    }
  },
  {
    "id": "plasmacyte",
    "name": "Plasmacyte",
    "game_version": {
      "edition": "10th",
      "dataslate": "2025-q3"
    },
    "external_refs": [
      {
        "namespace": "mfm",
        "id": "f6a5f8a4-40f5-498d-a806-d6d77283329d"
      }
    ]
  },
  {
    "id": "nanoscarab-amulet",
    "name": "nanoscarab amulet",
    "game_version": {
      "edition": "10th",
      "dataslate": "2025-q3"
    },
    "external_refs": [
      {
        "namespace": "mfm",
        "id": "c0da2d15-20c2-4da9-a9df-a0ce62051918"
      }
    ]
  },
  {
    "id": "accelerator-mandible",
    "name": "accelerator mandible",
    "game_version": {
      "edition": "10th",
      "dataslate": "2025-q3"
    },
    "external_refs": [
      {
        "namespace": "mfm",
        "id": "f8700f44-a5d3-43d0-b34f-c2b09a6b504b"
      }
    ]
  },
  {
    "id": "nanoscarab-projector",
    "name": "Nanoscarab Projector",
    "game_version": {
      "edition": "11th",
      "dataslate": "launch"
    },
    "external_refs": [
      {
        "namespace": "mfm",
        "id": "3d8f77b6-4a7b-4a37-9914-cc47a35ec847"
      }
    ]
  },
  {
    "id": "fabricator-claw-array-aura",
    "name": "Fabricator Claw Array (Aura)",
    "game_version": {
      "edition": "11th",
      "dataslate": "launch"
    },
    "external_refs": [
      {
        "namespace": "mfm",
        "id": "ea2d4f7d-612f-41a0-980f-c538a5dc020d"
      }
    ]
  },
  {
    "id": "gloom-prism-aura",
    "name": "Gloom Prism (Aura)",
    "game_version": {
      "edition": "11th",
      "dataslate": "launch"
    },
    "external_refs": [
      {
        "namespace": "mfm",
        "id": "5084d88f-827f-4b35-90c6-86d8f84d6863"
      }
    ]
  },
  {
    "id": "nullstone-field-generator-aura",
    "name": "Nullstone Field Generator (Aura)",
    "game_version": {
      "edition": "11th",
      "dataslate": "launch"
    },
    "external_refs": [
      {
        "namespace": "mfm",
        "id": "d0064c2e-8a21-4d58-bf03-02e6370585bb"
      }
    ]
  }
]
